{
  "id": "go-feature-l1-c3",
  "type": "feature",
  "effort_size": "small",
  "complexity": {
    "business_complexity": "L1_standardized",
    "context_maturity": "C3_missing"
  },
  "time_budget_minutes": 25,
  "max_human_interventions": 2,
  "max_cost_usd": 1.5,
  "target": {
    "repo": "https://github.com/ZacharyFan/ai-coding-evaluation-demo-golang.git",
    "base_ref": "85dfb40909e0ef9e5d62e53e8e987256756fca9b",
    "solution_ref": "31d1a6e57713a4e24e0599d3f8c2a52a71ff62d2",
    "language": "go",
    "package_manager": "go",
    "setup_commands": [],
    "test_commands": [
      "./scripts/run_eval_case.sh go-feature-l1-c3"
    ],
    "working_directory": "."
  },
  "required_tests": [
    "./tests.sh"
  ],
  "hidden_checks": [
    "No context doc is created.",
    "The feature remains a single aggregate method."
  ],
  "scope": {
    "allowed_paths": [
      "customerprofile/**"
    ]
  },
  "scoring_weights": {
    "correctness": 35,
    "regression_safety": 15,
    "maintainability": 15,
    "test_quality": 10,
    "security": 10,
    "process_compliance": 5,
    "efficiency": 10
  }
}
