{
  "id": "refactor",
  "type": "refactor",
  "effort_size": "medium",
  "complexity": {
    "business_complexity": "L2_linked",
    "context_maturity": "C2_partial"
  },
  "time_budget_minutes": 40,
  "max_human_interventions": 3,
  "max_cost_usd": 2.5,
  "target": {
    "repo": "replace-with-public-git-url-or-local-path-for-benchmarks-local",
    "base_ref": "replace-with-full-commit-sha",
    "solution_ref": "optional-reference-solution-sha",
    "language": "replace-with-language",
    "package_manager": "replace-with-package-manager",
    "setup_commands": [],
    "test_commands": [
      "./tests.sh"
    ],
    "working_directory": "."
  },
  "required_tests": [
    "./tests.sh"
  ],
  "hidden_checks": [
    "Behavior is unchanged.",
    "Diff reduces real complexity or duplication.",
    "No opportunistic rewrites outside the target area."
  ],
  "scope": {
    "allowed_paths": [
      "replace-with-target-path/**"
    ]
  },
  "scoring_weights": {
    "correctness": 35,
    "regression_safety": 15,
    "maintainability": 15,
    "test_quality": 10,
    "security": 10,
    "process_compliance": 5,
    "efficiency": 10
  },
  "context_sources": [
    {
      "type": "knowledge",
      "path_globs": [
        "docs/contexts/**"
      ]
    },
    {
      "type": "component_doc",
      "path_globs": [
        "docs/components/**"
      ]
    },
    {
      "type": "project_doc",
      "path_globs": [
        "README.md",
        "README.zh-CN.md",
        "AGENTS.md",
        "docs/**/*.md"
      ]
    },
    {
      "type": "spec",
      "path_globs": [
        "task.md",
        "task.zh-CN.md",
        "specs/**"
      ]
    },
    {
      "type": "skill",
      "path_globs": [
        ".codex/skills/**",
        ".claude/agents/**"
      ]
    }
  ]
}
