{
  "id": "go-feature-l2-c1",
  "type": "feature",
  "effort_size": "medium",
  "complexity": {
    "business_complexity": "L2_linked",
    "context_maturity": "C1_complete"
  },
  "time_budget_minutes": 40,
  "max_human_interventions": 3,
  "max_cost_usd": 2.5,
  "target": {
    "repo": "https://github.com/ZacharyFan/ai-coding-evaluation-demo-golang.git",
    "base_ref": "85dfb40909e0ef9e5d62e53e8e987256756fca9b",
    "solution_ref": "76398a58dad53324e25c4326cd9ae9d0531ab2bf",
    "language": "go",
    "package_manager": "go",
    "setup_commands": [],
    "test_commands": [
      "./scripts/run_eval_case.sh go-feature-l2-c1"
    ],
    "working_directory": "."
  },
  "required_tests": [
    "./tests.sh"
  ],
  "hidden_checks": [
    "The feature crosses at least three domain packages.",
    "The documented checkout flow is preserved."
  ],
  "scope": {
    "allowed_paths": [
      "checkout/**",
      "cart/**",
      "pricing/**",
      "inventory/**",
      "shipping/**",
      "docs/contexts/checkout.md"
    ]
  },
  "scoring_weights": {
    "correctness": 35,
    "regression_safety": 15,
    "maintainability": 15,
    "test_quality": 10,
    "security": 10,
    "process_compliance": 5,
    "efficiency": 10
  },
  "context_sources": [
    {
      "type": "knowledge",
      "path_globs": [
        "docs/contexts/**"
      ]
    },
    {
      "type": "component_doc",
      "path_globs": [
        "docs/components/**"
      ]
    },
    {
      "type": "project_doc",
      "path_globs": [
        "README.md",
        "README.zh-CN.md",
        "AGENTS.md",
        "docs/**/*.md"
      ]
    },
    {
      "type": "spec",
      "path_globs": [
        "task.md",
        "task.zh-CN.md",
        "specs/**"
      ]
    },
    {
      "type": "skill",
      "path_globs": [
        ".codex/skills/**",
        ".claude/agents/**"
      ]
    }
  ]
}
