{
  "id": "go-feature-l2-c2",
  "type": "feature",
  "effort_size": "medium",
  "complexity": {
    "business_complexity": "L2_linked",
    "context_maturity": "C2_partial"
  },
  "time_budget_minutes": 40,
  "max_human_interventions": 3,
  "max_cost_usd": 2.5,
  "target": {
    "repo": "https://github.com/ZacharyFan/ai-coding-evaluation-demo-golang.git",
    "base_ref": "85dfb40909e0ef9e5d62e53e8e987256756fca9b",
    "solution_ref": "f6133bff733f832b93463b57cf22e9df7522bf7d",
    "language": "go",
    "package_manager": "go",
    "setup_commands": [],
    "test_commands": [
      "./scripts/run_eval_case.sh go-feature-l2-c2"
    ],
    "working_directory": "."
  },
  "required_tests": [
    "./tests.sh"
  ],
  "hidden_checks": [
    "The feature links orders and refunds without side effects.",
    "Partial docs are not expanded."
  ],
  "scope": {
    "allowed_paths": [
      "returns/**",
      "orders/**",
      "refunds/**",
      "inventory/**",
      "ledger/**",
      "docs/contexts/returns.md"
    ]
  },
  "scoring_weights": {
    "correctness": 35,
    "regression_safety": 15,
    "maintainability": 15,
    "test_quality": 10,
    "security": 10,
    "process_compliance": 5,
    "efficiency": 10
  }
}
