{
  "id": "go-bugfix-l1-c3",
  "type": "bugfix",
  "effort_size": "small",
  "complexity": {
    "business_complexity": "L1_standardized",
    "context_maturity": "C3_missing"
  },
  "time_budget_minutes": 25,
  "max_human_interventions": 2,
  "max_cost_usd": 1.5,
  "target": {
    "repo": "https://github.com/ZacharyFan/ai-coding-evaluation-demo-golang.git",
    "base_ref": "85dfb40909e0ef9e5d62e53e8e987256756fca9b",
    "solution_ref": "0be228ab40774dea68362f503a8b3559d5db6cf8",
    "language": "go",
    "package_manager": "go",
    "setup_commands": [],
    "test_commands": [
      "./scripts/run_eval_case.sh go-bugfix-l1-c3"
    ],
    "working_directory": "."
  },
  "required_tests": [
    "./tests.sh"
  ],
  "hidden_checks": [
    "The behavior is inferred from code/tests, not docs.",
    "No new context doc is added for C3."
  ],
  "scope": {
    "allowed_paths": [
      "customerprofile/**"
    ]
  },
  "scoring_weights": {
    "correctness": 35,
    "regression_safety": 15,
    "maintainability": 15,
    "test_quality": 10,
    "security": 10,
    "process_compliance": 5,
    "efficiency": 10
  },
  "context_sources": [
    {
      "type": "knowledge",
      "path_globs": [
        "docs/contexts/**"
      ]
    },
    {
      "type": "component_doc",
      "path_globs": [
        "docs/components/**"
      ]
    },
    {
      "type": "project_doc",
      "path_globs": [
        "README.md",
        "README.zh-CN.md",
        "AGENTS.md",
        "docs/**/*.md"
      ]
    },
    {
      "type": "spec",
      "path_globs": [
        "task.md",
        "task.zh-CN.md",
        "specs/**"
      ]
    },
    {
      "type": "skill",
      "path_globs": [
        ".codex/skills/**",
        ".claude/agents/**"
      ]
    }
  ]
}
