{
  "id": "go-test-l2-c3",
  "type": "test",
  "effort_size": "medium",
  "complexity": {
    "business_complexity": "L2_linked",
    "context_maturity": "C3_missing"
  },
  "time_budget_minutes": 40,
  "max_human_interventions": 3,
  "max_cost_usd": 2.5,
  "target": {
    "repo": "https://github.com/ZacharyFan/ai-coding-evaluation-demo-golang.git",
    "base_ref": "85dfb40909e0ef9e5d62e53e8e987256756fca9b",
    "solution_ref": "f57aa28f41168f93a73e4b8b71da574263b5d256",
    "language": "go",
    "package_manager": "go",
    "setup_commands": [],
    "test_commands": [
      "./scripts/run_eval_case.sh go-test-l2-c3"
    ],
    "working_directory": "."
  },
  "required_tests": [
    "./tests.sh"
  ],
  "hidden_checks": [
    "The named test spans three domains.",
    "C3 remains undocumented."
  ],
  "scope": {
    "allowed_paths": [
      "subscriptions/**",
      "account/**",
      "billing/**",
      "entitlement/**"
    ]
  },
  "scoring_weights": {
    "correctness": 35,
    "regression_safety": 15,
    "maintainability": 15,
    "test_quality": 10,
    "security": 10,
    "process_compliance": 5,
    "efficiency": 10
  },
  "context_sources": [
    {
      "type": "knowledge",
      "path_globs": [
        "docs/contexts/**"
      ]
    },
    {
      "type": "component_doc",
      "path_globs": [
        "docs/components/**"
      ]
    },
    {
      "type": "project_doc",
      "path_globs": [
        "README.md",
        "README.zh-CN.md",
        "AGENTS.md",
        "docs/**/*.md"
      ]
    },
    {
      "type": "spec",
      "path_globs": [
        "task.md",
        "task.zh-CN.md",
        "specs/**"
      ]
    },
    {
      "type": "skill",
      "path_globs": [
        ".codex/skills/**",
        ".claude/agents/**"
      ]
    }
  ]
}
